{
  "schema_version": "ores.review-canary.v1",
  "repository": "example-test/review-canary",
  "pull_request": 7,
  "app_ids": {
    "openai": 101,
    "claude": 102,
    "gate": 103
  },
  "first_head_sha": "aaaaaaaaaaaaaaaaaaaaaaaaaaaaaaaaaaaaaaaa",
  "second_head_sha": "bbbbbbbbbbbbbbbbbbbbbbbbbbbbbbbbbbbbbbbb",
  "readiness": {
    "status": 200,
    "observed_at": "2026-09-01T12:00:00Z"
  },
  "webhook": {
    "event": "pull_request",
    "action": "synchronize",
    "delivery_id": "example-delivery-2",
    "observed_at": "2026-09-01T12:02:00Z"
  },
  "snapshots": {
    "first_head_complete": {
      "observed_at": "2026-09-01T12:01:00Z",
      "head_sha": "aaaaaaaaaaaaaaaaaaaaaaaaaaaaaaaaaaaaaaaa",
      "checks": [
        {
          "name": "ores-review/openai",
          "app_id": 101,
          "external_id": "openai:example-test/review-canary#7@aaaaaaaaaaaaaaaaaaaaaaaaaaaaaaaaaaaaaaaa:attempt:11111111111111111111111111111111",
          "head_sha": "aaaaaaaaaaaaaaaaaaaaaaaaaaaaaaaaaaaaaaaa",
          "status": "completed",
          "conclusion": "success"
        },
        {
          "name": "ores-review/claude",
          "app_id": 102,
          "external_id": "claude:example-test/review-canary#7@aaaaaaaaaaaaaaaaaaaaaaaaaaaaaaaaaaaaaaaa:attempt:22222222222222222222222222222222",
          "head_sha": "aaaaaaaaaaaaaaaaaaaaaaaaaaaaaaaaaaaaaaaa",
          "status": "completed",
          "conclusion": "success"
        },
        {
          "name": "ores-review/gate",
          "app_id": 103,
          "external_id": "gate:example-test/review-canary#7@aaaaaaaaaaaaaaaaaaaaaaaaaaaaaaaaaaaaaaaa",
          "head_sha": "aaaaaaaaaaaaaaaaaaaaaaaaaaaaaaaaaaaaaaaa",
          "status": "completed",
          "conclusion": "success"
        }
      ]
    },
    "second_head_pending": {
      "observed_at": "2026-09-01T12:02:01Z",
      "head_sha": "bbbbbbbbbbbbbbbbbbbbbbbbbbbbbbbbbbbbbbbb",
      "checks": [
        {
          "name": "ores-review/openai",
          "app_id": 101,
          "external_id": "openai:example-test/review-canary#7@bbbbbbbbbbbbbbbbbbbbbbbbbbbbbbbbbbbbbbbb:attempt:11111111111111111111111111111111",
          "head_sha": "bbbbbbbbbbbbbbbbbbbbbbbbbbbbbbbbbbbbbbbb",
          "status": "in_progress",
          "conclusion": null
        },
        {
          "name": "ores-review/gate",
          "app_id": 103,
          "external_id": "gate:example-test/review-canary#7@bbbbbbbbbbbbbbbbbbbbbbbbbbbbbbbbbbbbbbbb",
          "head_sha": "bbbbbbbbbbbbbbbbbbbbbbbbbbbbbbbbbbbbbbbb",
          "status": "in_progress",
          "conclusion": null
        }
      ]
    },
    "second_head_complete": {
      "observed_at": "2026-09-01T12:04:00Z",
      "head_sha": "bbbbbbbbbbbbbbbbbbbbbbbbbbbbbbbbbbbbbbbb",
      "checks": [
        {
          "name": "ores-review/openai",
          "app_id": 101,
          "external_id": "openai:example-test/review-canary#7@bbbbbbbbbbbbbbbbbbbbbbbbbbbbbbbbbbbbbbbb:attempt:11111111111111111111111111111111",
          "head_sha": "bbbbbbbbbbbbbbbbbbbbbbbbbbbbbbbbbbbbbbbb",
          "status": "completed",
          "conclusion": "success"
        },
        {
          "name": "ores-review/claude",
          "app_id": 102,
          "external_id": "claude:example-test/review-canary#7@bbbbbbbbbbbbbbbbbbbbbbbbbbbbbbbbbbbbbbbb:attempt:22222222222222222222222222222222",
          "head_sha": "bbbbbbbbbbbbbbbbbbbbbbbbbbbbbbbbbbbbbbbb",
          "status": "completed",
          "conclusion": "success"
        },
        {
          "name": "ores-review/gate",
          "app_id": 103,
          "external_id": "gate:example-test/review-canary#7@bbbbbbbbbbbbbbbbbbbbbbbbbbbbbbbbbbbbbbbb",
          "head_sha": "bbbbbbbbbbbbbbbbbbbbbbbbbbbbbbbbbbbbbbbb",
          "status": "completed",
          "conclusion": "success"
        }
      ]
    }
  },
  "ruleset": {
    "name": "ORES dual-AI review gate",
    "enforcement": "evaluate",
    "branch_mode": "all",
    "targets": [
      "refs/heads/**"
    ],
    "required_checks": [
      {
        "name": "ores-review/openai",
        "app_id": 101
      },
      {
        "name": "ores-review/claude",
        "app_id": 102
      },
      {
        "name": "ores-review/gate",
        "app_id": 103
      }
    ]
  },
  "evidence_sha256": "a7dd8762dbf2d0e457ea01291e5f5d32d4c43c4b220abe30a09e3fe960f27a80"
}
